{
  "meta":{"schema_version":"0.18","generated_at":"2026-09-16T15:29:00Z","source_commit":"4f571cd038c3c763abeffe6f11a5a0a0d505500f","branch":"fix/native-private-execution-20260914","latest_validated_run":"TRI-DSA-DEV-20260916-FINAL-CAPTURE-005","evidence_timestamp":"2026-09-16T14:12:18Z"},
  "system":{"overall_state":"BLOCKED","current_stage":"O_GATE_A_PREAUTH_PREPARATION","next_action":"Complete deterministic Dashboard/O/U preparation; request owner authorization only after all O Gate A preconditions pass.","last_successful_gate":"FINAL_PIPELINE_CAPTURE_ACCEPTED","blocking_gate":"NEW_O_GATE_A_PROVIDER_SLOT_NOT_AUTHORIZED","error_code":"OWNER_AUTH_REQUIRED_FOR_NEW_PROVIDER_SLOT"},
  "O":{"denominator":null,"attempted":null,"succeeded":null,"failed":null,"accepted":0,"top3":[],"signal":"WAIT","qualified_buy":false,"latest_session":null,"model_http_requests":0,"input_tokens":0,"output_tokens":0,"total_tokens":0,"estimated_or_actual_cost":0,"evidence_status":"LAST_VALIDATED_NO_GO_CHILD2; NEW_GATE_A_NOT_RUN"},
  "U":{"denominator":45,"attempted":0,"succeeded":0,"failed":0,"accepted":0,"top3":[],"signal":"WAIT","qualified_buy":false},
  "data_health":{"fresh_preflight":"NOT_VERIFIED_FOR_NEW_GATE_A","provider":"PREP_REQUIRED","session":"PREP_REQUIRED","OHLC":"PREP_REQUIRED","volume":"CALIBRATION_AVAILABLE_RECHECK_REQUIRED","news":"PREP_REQUIRED","issuer":"PREP_REQUIRED","manifest":"PREP_REQUIRED"},
  "observer":{"pass_fail":"PASS_FINAL_CAPTURE_ENGINEERING","block_count":0,"latest_error_code":null},
  "storage":{"save":"PASS_HISTORICAL","independent_read":"PASS_HISTORICAL","sha_match":"PASS_HISTORICAL","revision_check":"PASS_HISTORICAL","restore_verified":"PASS_HISTORICAL","canonical_claim_count":1,"canonical_native_count":1},
  "budget":{"affordability":"NOT_VERIFIED_FOR_NEW_GATE_A","request_limit":0,"actual_request_count":0,"tokens":{"input":0,"output":0,"total":0},"cost":0},
  "simulation":{"eligibility":"WAIT_NOT_ELIGIBLE","account_A":"NOT_VERIFIED","account_B":"NOT_VERIFIED","cash":"NOT_VERIFIED","positions":"NOT_VERIFIED","pnl":"NOT_VERIFIED","pending_signal":"WAIT"},
  "shadow_week":{"date":"2026-09-16","data_pass_rate":"NOT_VERIFIED","observer_block_rate":"NOT_VERIFIED","model_success_rate":"NOT_APPLICABLE_NO_MODEL_CALL","cost_per_accepted_analysis":"NOT_APPLICABLE","O_coverage":"0 accepted / denominator not yet frozen","U_coverage":"0/45 formal accepted","top3_turnover":"NOT_VERIFIED","signal_persistence":"WAIT","BUY_WAIT":"WAIT","simulation_eligibility":"WAIT_NOT_ELIGIBLE"},
  "debug":{"provider_error":null,"preflight_error":null,"observer_error":null,"drive_error":null,"model_error":"CHILD2_SEMANTIC_NO_GO_PRESERVED","recovery_state":"NEW_CASE_REQUIRED","recovery_condition":"Do not retry CHILD2; complete fresh Gate A preauth and obtain explicit owner authorization for a new provider slot."}
}
